{
  "case_id": "001_music_production_baseline",
  "agent": "SCRIBE",
  "method": "propose_topics",
  "input": {
    "topic_preferences": "music production tips for independent artists recording at home"
  },
  "expected": {
    "should_succeed": true,
    "expected_topic_count": 3,
    "required_domain_tags": ["music production", "recording"],
    "forbidden_domain_tags": ["productivity", "personal branding", "release reviews"]
  },
  "notes": "Baseline allowed-domain request."
}
